{
  "scan_id": "demo-fixtures-v1",
  "started_at": "2026-02-26T01:00:00Z",
  "completed_at": "2026-02-26T01:00:05Z",
  "targets": [
    {"id": "tls-1", "host": "localhost", "port": 4431, "protocol": "tls", "label": "NGINX TLS 1.0 (RC4, RSA-1024, SHA-1)"},
    {"id": "tls-2", "host": "localhost", "port": 4432, "protocol": "tls", "label": "NGINX TLS 1.2 (No Forward Secrecy)"},
    {"id": "tls-3", "host": "localhost", "port": 4433, "protocol": "tls", "label": "NGINX TLS 1.3 (Reference - Good)"},
    {"id": "ssh-1", "host": "localhost", "port": 2222, "protocol": "ssh", "label": "SSH Weak KEX + DSA Host Key"},
    {"id": "http-1", "host": "localhost", "port": 5001, "protocol": "http", "label": "Legacy MD5 Hash API"},
    {"id": "tls-4", "host": "localhost", "port": 8443, "protocol": "tls", "label": "Java Legacy HTTPS (RSA-512, MD5withRSA)"}
  ],
  "findings": [
    {
      "id": "f-001",
      "target_id": "tls-1",
      "target_label": "NGINX TLS 1.0 (RC4, RSA-1024, SHA-1)",
      "host": "localhost",
      "port": 4431,
      "protocol": "tls",
      "finding_type": "WEAK_TLS_VERSION",
      "title": "TLS 1.0 Detected",
      "description": "TLS 1.0 is deprecated and contains known vulnerabilities (BEAST, POODLE). It is prohibited by BSI TR-02102-2 and eIDAS 2.0.",
      "evidence": "TLS version: TLS 1.0 (0x0301)",
      "severity": "CRITICAL",
      "algorithm": "TLS 1.0",
      "key_length": 0,
      "remediation": "Upgrade to TLS 1.2 (minimum) or TLS 1.3. Disable TLS 1.0 and TLS 1.1 in server configuration.",
      "bsi_ref": "BSI TR-02102-2, Section 3.2",
      "dora_ref": "DORA Art. 9(2) – ICT risk management",
      "eidas_ref": "eIDAS 2.0 ETSI TS 119 312",
      "quantum_safe": false,
      "scanned_at": "2026-02-26T01:00:01Z"
    },
    {
      "id": "f-002",
      "target_id": "tls-1",
      "target_label": "NGINX TLS 1.0 (RC4, RSA-1024, SHA-1)",
      "host": "localhost",
      "port": 4431,
      "protocol": "tls",
      "finding_type": "WEAK_CIPHER_RC4",
      "title": "RC4 Cipher Suite Detected",
      "description": "RC4 is a broken stream cipher with multiple known vulnerabilities (BEAST, RC4 biases). Its use is prohibited.",
      "evidence": "Negotiated cipher: TLS_RSA_WITH_RC4_128_SHA",
      "severity": "CRITICAL",
      "algorithm": "RC4",
      "key_length": 128,
      "remediation": "Disable RC4 cipher suites. Use ECDHE with AES-GCM or ChaCha20-Poly1305.",
      "bsi_ref": "BSI TR-02102-2, Section 3.3.1",
      "dora_ref": "DORA Art. 9(2) – ICT risk management",
      "eidas_ref": "eIDAS 2.0 ETSI TS 119 312",
      "quantum_safe": false,
      "scanned_at": "2026-02-26T01:00:01Z"
    },
    {
      "id": "f-003",
      "target_id": "tls-4",
      "target_label": "Java Legacy HTTPS (RSA-512, MD5withRSA)",
      "host": "localhost",
      "port": 8443,
      "protocol": "tls",
      "finding_type": "WEAK_KEY_RSA",
      "title": "RSA Key Too Short (512 bits)",
      "description": "RSA-512 key is cryptographically weak and can be factored with modern hardware. Minimum acceptable is RSA-2048.",
      "evidence": "Certificate public key: RSA-512",
      "severity": "CRITICAL",
      "algorithm": "RSA",
      "key_length": 512,
      "remediation": "Replace certificate with RSA-3072 or higher (BSI recommends RSA-3072 for post-2022 use).",
      "bsi_ref": "BSI TR-02102-1, Section 3.5",
      "dora_ref": "DORA Art. 9(4)(b) – strong authentication",
      "eidas_ref": "eIDAS 2.0 Annex IV",
      "quantum_safe": false,
      "scanned_at": "2026-02-26T01:00:05Z"
    },
    {
      "id": "f-004",
      "target_id": "tls-1",
      "target_label": "NGINX TLS 1.0 (RC4, RSA-1024, SHA-1)",
      "host": "localhost",
      "port": 4431,
      "protocol": "tls",
      "finding_type": "WEAK_SIG_SHA1",
      "title": "SHA-1 Certificate Signature",
      "description": "SHA-1 is deprecated for certificate signing. Practical collision attacks have been demonstrated (SHAttered). Browsers reject SHA-1 certificates.",
      "evidence": "Certificate signature algorithm: SHA1withRSA",
      "severity": "HIGH",
      "algorithm": "SHA1withRSA",
      "key_length": 0,
      "remediation": "Re-issue certificate using SHA-256 or SHA-384 signature algorithm.",
      "bsi_ref": "BSI TR-02102-1, Section 3.3",
      "dora_ref": "DORA Art. 9(2)",
      "eidas_ref": "eIDAS 2.0 ETSI TS 119 312",
      "quantum_safe": false,
      "scanned_at": "2026-02-26T01:00:01Z"
    },
    {
      "id": "f-005",
      "target_id": "ssh-1",
      "target_label": "SSH Weak KEX + DSA Host Key",
      "host": "localhost",
      "port": 2222,
      "protocol": "ssh",
      "finding_type": "WEAK_SSH_KEX",
      "title": "CRITICAL: Oakley Group 1 (768-bit DH) KEX Detected",
      "description": "diffie-hellman-group1-sha1 uses 768-bit Diffie-Hellman (Oakley Group 1) which is trivially breakable with modern hardware (Logjam attack).",
      "evidence": "SSH KEX algorithm offered: diffie-hellman-group1-sha1",
      "severity": "HIGH",
      "algorithm": "diffie-hellman-group1-sha1",
      "key_length": 768,
      "remediation": "Remove weak KEX algorithms from sshd_config. Use curve25519-sha256 or diffie-hellman-group16-sha512.",
      "bsi_ref": "BSI TR-02102-4, Section 3.2",
      "dora_ref": "DORA Art. 9(2)",
      "eidas_ref": "eIDAS 2.0 ETSI TS 119 312",
      "quantum_safe": false,
      "scanned_at": "2026-02-26T01:00:03Z"
    },
    {
      "id": "f-006",
      "target_id": "tls-2",
      "target_label": "NGINX TLS 1.2 (No Forward Secrecy)",
      "host": "localhost",
      "port": 4432,
      "protocol": "tls",
      "finding_type": "NO_FORWARD_SECRECY",
      "title": "TLS 1.2 Without Forward Secrecy",
      "description": "TLS 1.2 is in use but the negotiated cipher suite does not provide forward secrecy (no ECDHE/DHE key exchange).",
      "evidence": "TLS 1.2 with cipher suite: TLS_RSA_WITH_AES_128_CBC_SHA",
      "severity": "HIGH",
      "algorithm": "TLS_RSA_WITH_AES_128_CBC_SHA",
      "key_length": 0,
      "remediation": "Configure cipher suite preference to require ECDHE or DHE key exchange for forward secrecy.",
      "bsi_ref": "BSI TR-02102-2, Section 3.3",
      "dora_ref": "DORA Art. 9(2) – ICT risk management",
      "eidas_ref": "eIDAS 2.0 ETSI TS 119 312",
      "quantum_safe": false,
      "scanned_at": "2026-02-26T01:00:02Z"
    },
    {
      "id": "f-007",
      "target_id": "tls-2",
      "target_label": "NGINX TLS 1.2 (No Forward Secrecy)",
      "host": "localhost",
      "port": 4432,
      "protocol": "tls",
      "finding_type": "RSA_2048_SUBOPTIMAL",
      "title": "RSA-2048 Key (Upgrade Recommended)",
      "description": "RSA-2048 meets current minimums but BSI TR-02102-1 recommends RSA-3072 or higher for long-term security beyond 2025.",
      "evidence": "Certificate public key: RSA-2048",
      "severity": "MEDIUM",
      "algorithm": "RSA",
      "key_length": 2048,
      "remediation": "Plan migration to RSA-3072 or ECDSA-P-256/P-384 for better performance and longer security horizon.",
      "bsi_ref": "BSI TR-02102-1, Section 3.5",
      "dora_ref": "DORA Art. 9(4)(b)",
      "eidas_ref": "eIDAS 2.0 Annex IV",
      "quantum_safe": false,
      "scanned_at": "2026-02-26T01:00:02Z"
    },
    {
      "id": "f-008",
      "target_id": "tls-3",
      "target_label": "NGINX TLS 1.3 (Reference - Good)",
      "host": "localhost",
      "port": 4433,
      "protocol": "tls",
      "finding_type": "TLS12_BEST_PRACTICE",
      "title": "TLS 1.2 Best Practice: Prefer TLS 1.3",
      "description": "While TLS 1.2 is acceptable, TLS 1.3 provides improved security and performance with mandatory forward secrecy.",
      "evidence": "TLS 1.2 negotiated",
      "severity": "MEDIUM",
      "algorithm": "TLS 1.2",
      "key_length": 0,
      "remediation": "Configure the server to prefer TLS 1.3 and restrict TLS 1.2 to approved cipher suites only.",
      "bsi_ref": "BSI TR-02102-2, Section 3.2",
      "dora_ref": "DORA Art. 9(2)",
      "eidas_ref": "eIDAS 2.0 ETSI TS 119 312",
      "quantum_safe": false,
      "scanned_at": "2026-02-26T01:00:02Z"
    },
    {
      "id": "f-009",
      "target_id": "http-1",
      "target_label": "Legacy MD5 Hash API",
      "host": "localhost",
      "port": 5001,
      "protocol": "http",
      "finding_type": "MISSING_HSTS",
      "title": "Missing HTTP Strict-Transport-Security Header",
      "description": "The Strict-Transport-Security (HSTS) header is absent, allowing potential protocol downgrade attacks.",
      "evidence": "HTTP response missing 'Strict-Transport-Security' header",
      "severity": "MEDIUM",
      "algorithm": "",
      "key_length": 0,
      "remediation": "Add 'Strict-Transport-Security: max-age=63072000; includeSubDomains; preload' to all HTTPS responses.",
      "bsi_ref": "BSI TR-02102-2, Section 3.6",
      "dora_ref": "DORA Art. 9(2)",
      "quantum_safe": false,
      "scanned_at": "2026-02-26T01:00:04Z"
    },
    {
      "id": "f-010",
      "target_id": "http-1",
      "target_label": "Legacy MD5 Hash API",
      "host": "localhost",
      "port": 5001,
      "protocol": "http",
      "finding_type": "MISSING_XCTO",
      "title": "Missing X-Content-Type-Options Header",
      "description": "The X-Content-Type-Options header is missing. This can allow MIME-sniffing attacks.",
      "evidence": "HTTP response missing 'X-Content-Type-Options' header",
      "severity": "LOW",
      "algorithm": "",
      "key_length": 0,
      "remediation": "Add 'X-Content-Type-Options: nosniff' to all HTTP responses.",
      "bsi_ref": "BSI TR-03161, Section 4.1",
      "dora_ref": "DORA Art. 9(2)",
      "quantum_safe": false,
      "scanned_at": "2026-02-26T01:00:04Z"
    },
    {
      "id": "f-011",
      "target_id": "http-1",
      "target_label": "Legacy MD5 Hash API",
      "host": "localhost",
      "port": 5001,
      "protocol": "http",
      "finding_type": "MISSING_XFO",
      "title": "Missing X-Frame-Options Header",